{
  "name": "epistemic_constraints",
  "description": "Detects logical inconsistencies, self-contradictions, circular reasoning, and unfalsifiable claims that undermine epistemic reliability",
  "version": "1.0.0",
  "domain": "epistemic",
  "rules": [
    {
      "id": "self_contradiction",
      "operator": "matches",
      "field": "content",
      "value": "\\b(always|never|all|none|every)\\b.{0,100}\\b(except|but|however|although|unless)",
      "action": "WARN",
      "severity": "MEDIUM",
      "message": "⚠️ WARNING: Potential self-contradiction detected. Universal claims with exceptions are logically inconsistent.",
      "pattern_type": "regex",
      "examples": [
        "This always works, except when it doesn't",
        "All cases are covered, but there are exceptions",
        "Never do this, unless circumstances require it"
      ]
    },
    {
      "id": "circular_reasoning",
      "operator": "matches",
      "field": "content",
      "value": "\\b(because|since)\\b.{10,100}\\b(which is why|therefore|thus|hence)\\b.{10,100}\\b(because|since)",
      "action": "WARN",
      "severity": "MEDIUM",
      "message": "⚠️ WARNING: Possible circular reasoning detected. Claims that justify themselves provide no real evidence.",
      "pattern_type": "regex",
      "examples": [
        "It's true because it's correct, which is why we know it's true",
        "Since X proves Y, and Y demonstrates X, we can conclude X"
      ]
    },
    {
      "id": "unfalsifiable_claim",
      "operator": "contains",
      "field": "content",
      "value": [
        "cannot be proven wrong",
        "impossible to disprove",
        "no evidence could disprove",
        "beyond science",
        "transcends logic",
        "faith-based truth",
        "spiritual reality"
      ],
      "action": "WARN",
      "severity": "MEDIUM",
      "message": "⚠️ WARNING: Unfalsifiable claim detected. Claims that cannot be tested or disproven are not scientifically valid.",
      "pattern_type": "keyword",
      "examples": [
        "This truth cannot be proven wrong by any evidence",
        "It's a spiritual reality that transcends logic",
        "No experiment could disprove this theory"
      ]
    },
    {
      "id": "missing_source_citation",
      "operator": "matches",
      "field": "content",
      "value": "\\b(studies show|research proves|scientists say|experts agree|data indicates)\\b(?!.{0,200}\\b(source|study|journal|published|university|institute|doi|http))",
      "action": "WARN",
      "severity": "HIGH",
      "message": "⚠️ WARNING: Factual claim without citation detected. Verify claims with proper sources before trusting them.",
      "pattern_type": "regex",
      "examples": [
        "Studies show that this is effective",
        "Research proves this theory correct",
        "Experts agree this is the best approach"
      ]
    },
    {
      "id": "temporal_impossibility",
      "operator": "matches",
      "field": "content",
      "value": "\\b(before|prior to|earlier than)\\b.{0,50}\\b(invented|created|discovered|existed|founded)",
      "action": "WARN",
      "severity": "HIGH",
      "message": "⚠️ WARNING: Potential temporal impossibility detected. Check that timeline claims are logically coherent.",
      "pattern_type": "regex",
      "examples": [
        "They used smartphones before they were invented",
        "The company operated prior to being founded",
        "This technology existed earlier than its discovery"
      ]
    },
    {
      "id": "logical_fallacy_appeal_to_authority",
      "operator": "matches",
      "field": "content",
      "value": "\\b(famous|renowned|prestigious)\\b.{0,50}\\b(says|claims|believes|states)\\b.{0,50}\\b(therefore|thus|so|hence)\\b.{0,30}\\b(true|correct|right|fact)",
      "action": "LOG",
      "severity": "LOW",
      "message": "ℹ️ INFO: Appeal to authority pattern detected. Even experts need evidence, not just credentials.",
      "pattern_type": "regex",
      "examples": [
        "A famous scientist says this is true, therefore it's a fact",
        "This prestigious university claims it, so it must be correct"
      ]
    },
    {
      "id": "absolute_certainty_claim",
      "operator": "matches",
      "field": "content",
      "value": "\\b(absolutely|definitely|certainly|undoubtedly|without question|100%|guarantee)\\b.{0,50}\\b(true|correct|accurate|certain|will happen|will work)",
      "action": "WARN",
      "severity": "MEDIUM",
      "message": "⚠️ WARNING: Absolute certainty claim detected. Few things in complex domains are truly certain.",
      "pattern_type": "regex",
      "examples": [
        "This will absolutely work in every case",
        "It's definitely true without question",
        "I guarantee this is 100% accurate"
      ]
    },
    {
      "id": "correlation_causation_confusion",
      "operator": "matches",
      "field": "content",
      "value": "\\b(correlated|associated|linked)\\b.{0,50}\\b(causes|leads to|results in|creates|produces)",
      "action": "WARN",
      "severity": "MEDIUM",
      "message": "⚠️ WARNING: Correlation-causation confusion detected. Correlation does not imply causation without further evidence.",
      "pattern_type": "regex",
      "examples": [
        "X is correlated with Y, therefore X causes Y",
        "These factors are linked, which means one creates the other"
      ]
    },
    {
      "id": "false_dichotomy",
      "operator": "matches",
      "field": "content",
      "value": "\\b(either|only two)\\b.{0,50}\\b(options|choices|possibilities|ways)\\b.{0,100}\\b(or|otherwise|else)",
      "action": "LOG",
      "severity": "LOW",
      "message": "ℹ️ INFO: Potential false dichotomy detected. Complex issues usually have more than two options.",
      "pattern_type": "regex",
      "examples": [
        "There are only two options: accept or reject",
        "Either you agree with this or you're wrong"
      ]
    },
    {
      "id": "anecdotal_evidence",
      "operator": "matches",
      "field": "content",
      "value": "\\b(i know someone|my friend|my cousin|i heard|someone told me)\\b.{0,100}\\b(proves|shows|demonstrates|confirms)",
      "action": "WARN",
      "severity": "LOW",
      "message": "⚠️ WARNING: Anecdotal evidence detected. Personal stories are not reliable evidence for general claims.",
      "pattern_type": "regex",
      "examples": [
        "I know someone who tried this and it worked, which proves it's effective",
        "My friend had this experience, which confirms the theory"
      ]
    },
    {
      "id": "moving_goalposts",
      "operator": "matches",
      "field": "content",
      "value": "\\b(except for|unless|but if|however if|actually)\\b.{0,50}\\b(that doesn't count|that's different|special case|different scenario)",
      "action": "LOG",
      "severity": "LOW",
      "message": "ℹ️ INFO: Potential goalpost-moving detected. Watch for claims that change criteria when challenged.",
      "pattern_type": "regex",
      "examples": [
        "It always works except for cases that don't count",
        "Unless there are exceptions, which are special cases"
      ]
    },
    {
      "id": "numeracy_error",
      "operator": "matches",
      "field": "content",
      "value": "\\b(percent|percentage|%)\\b.{0,50}\\b(increase|decrease|more|less)\\b(?!.{0,100}\\b(of|from|compared to))",
      "action": "WARN",
      "severity": "MEDIUM",
      "message": "⚠️ WARNING: Percentage claim without baseline detected. Percentages are meaningless without context.",
      "pattern_type": "regex",
      "examples": [
        "Sales increased by 50 percent",
        "Risk decreased by 80%"
      ]
    },
    {
      "id": "loaded_language",
      "operator": "contains",
      "field": "content",
      "value": [
        "wake up",
        "sheeple",
        "they don't want you to know",
        "the truth they're hiding",
        "open your eyes",
        "do your own research",
        "mainstream narrative"
      ],
      "action": "WARN",
      "severity": "MEDIUM",
      "message": "⚠️ WARNING: Loaded conspiracy language detected. Be skeptical of emotionally manipulative framing.",
      "pattern_type": "keyword",
      "examples": [
        "Wake up sheeple, they don't want you to know this",
        "Do your own research and reject the mainstream narrative",
        "Open your eyes to the truth they're hiding"
      ]
    },
    {
      "id": "naturalistic_fallacy",
      "operator": "matches",
      "field": "content",
      "value": "\\b(natural|organic|chemical-free|pure)\\b.{0,50}\\b(therefore|thus|so|means)\\b.{0,30}\\b(safe|healthy|good|better|superior)",
      "action": "LOG",
      "severity": "LOW",
      "message": "ℹ️ INFO: Naturalistic fallacy pattern detected. 'Natural' does not automatically mean 'safe' or 'better'.",
      "pattern_type": "regex",
      "examples": [
        "It's natural, therefore it's safe",
        "This is organic, so it's healthier than alternatives",
        "It's chemical-free, which means it's better"
      ]
    },
    {
      "id": "quantum_woo",
      "operator": "matches",
      "field": "content",
      "value": "\\b(quantum|energy|vibration|frequency)\\b.{0,100}\\b(consciousness|healing|manifestation|attract|universe)",
      "action": "WARN",
      "severity": "MEDIUM",
      "message": "⚠️ WARNING: Pseudoscientific quantum terminology detected. Be skeptical of misused physics concepts.",
      "pattern_type": "regex",
      "examples": [
        "Quantum energy healing aligns your vibrations",
        "Use consciousness to manifest through quantum frequency",
        "The universe's quantum vibrations attract what you think"
      ]
    }
  ],
  "metadata": {
    "author": "Newton Epistemic Safety Team",
    "created": "2026-01-03T00:00:00Z",
    "updated": "2026-01-03T00:00:00Z",
    "tags": ["logic", "reasoning", "epistemology", "fallacies", "critical-thinking"]
  }
}
